,title,video_id,date
1310,[일본반응] &quot;한국 방송보다가 일본 방송 보려니 도저히 못보겠다!&quot; 한국한테 추월당해서 너무 참담하다는 일본 네티즌들,4TDkrL2ZdJs,<class 'datetime.date'>
1311,"[일본반응] 한국의 LNG선 조선업 선박 수주량 싹쓸이! 세계 1위, | 중국배 일본배 초토화된 이유 !",-6TzHMq34Us,<class 'datetime.date'>
1312,한국드라마 중국반응 | 펜트하우스 시즌1 顶楼  | 해외반응 火起来,VUzrrIFJTGo,<class 'datetime.date'>
1313,"[해외반응] 미나리, 브래드피트가 제작한 너무나 한국적인 미국영화",Kf_KADU8JQ8,<class 'datetime.date'>
1314,"[일본반응] 현무4미사일, 한국의 놀라운 기술! 사거리 3000km 일본, 중국 도시를 박살내는 대한민국의 저력!",e-n8ST_qk98,<class 'datetime.date'>
1315,[일본반응]시공기술이 부족해 한국에 비해 주택 단열 성능이 낮다고 하자 한숨 푹푹쉬는 우익반응&quot;한국은 한겨울에도 티셔츠 하나만 입고 지내서 정말 깜짝 놀랬어 &quot;,u-dUWsON8RA,<class 'datetime.date'>
1316,한국 소주를 마신 외국인 시댁 식구들의 폭발적인 반응!!,Yr2CB_1qNtc,<class 'datetime.date'>
1317,[일본반응] BTS 덕분에 미국에서 한국의 존재감이 장난 아니라며 한국을 따라하자는 일본 기자. &quot;수준이 다른데 마케팅만 따라해서 되겠냐?&quot; 팩폭하는 일본인들,zBTjbBfbRTc,<class 'datetime.date'>
1318,&quot;한국인들은 이걸 왜 해??&quot; 한국으로간 외국인이 이것을 보고 놀라는 이유 // &quot;한국인이 스마트한 이유가 있었네&quot; [해외반응],7Ez_KcFKopY,<class 'datetime.date'>
1319,"[일본반응] 한국이 지은 세계최고 높이 건물에 BTS 생일광고 &quot;한국은 기술과 문화 모두 정점이네, 일본과 너무 비교된다&quot; #일본#일본반응#일본인반응",kSdDjTvMUmU,<class 'datetime.date'>
1320,"또 한국이 세계최초 개발한 &quot;이것&quot; 외국인들이 경악한 이유, 한국은 도대체 몇년을 앞선거야? [해외반응/외국인반응]",p22ZF7E5Zug,<class 'datetime.date'>
1321,&quot;일본이 지어준 건물 어디갔어?&quot; 한국을 여행온 일본인이 깜짝 놀라자 더 놀란 외국인 반응 // &quot;한국의 심정이 이해간다&quot; [해외반응],wRwwVZzrG2M,<class 'datetime.date'>
1322,[일본반응] 세계로 뻗어나가고 인정받는 한국 김치에 일본인의 질투심이 폭발한 상황! &quot;미안해 자존심을 지키기엔 한국 김치가 너무 맛있는걸&quot;,7OIZBN5SPfc,<class 'datetime.date'>
1323,"[일본반응] 한국. 잘못 건드린 이란, 청해부대 최영함 출동 | 유조선 선박 나포 후회하는 이유!  대한민국 통쾌한 대반전!",r5pRlp0XMmQ,<class 'datetime.date'>
1324,&quot;한국인들은 멍청하고 바보같다&quot; 외국인이 바라본 한국의 충격적인 성장이유 // &quot;한국을 후진국이라 욕한 내가 부끄럽다&quot; [외국인반응],iNa707vhHcQ,<class 'datetime.date'>
1325,[일본반응]2021년 일본열도를 삼킨 한국영화~! ‘원더우먼1984‘을 제치고 외화 1위!,ME-LsWCzwf0,<class 'datetime.date'>
1326,[일본반응] &quot;왜 한국에게 패배했는가?&quot; 패배론이 일본을 지배하고 있는 상황. J-POP이 이렇게 처참하게 망한 이유가 뭘까 열띤 토론하는 일본인들,iK_Cob9MHAY,<class 'datetime.date'>
1327,한국 길거리 사진 한 장에 유럽인들이 극대노하는 이유?? // &quot;한국에 비하면 유럽은 최악의 후진국&quot; [외국인반응],fL4slOCaCrc,<class 'datetime.date'>
1328,|중국반응| 한국 조선업계의 막판 뒤집기! 12월 LNG선박 싹쓸이 수주로 중국에 역전하며 수주량 3년 연속 세계 1위!,Lt2gxXAKwN0,<class 'datetime.date'>
1329,"한국 일본 군사력 비교, 일본반응 | Japanese reactions for comparison of military power of Korea.",JM_O9_Jb7TI,<class 'datetime.date'>
1330,크리쳐물을 좋아하는 일본의 &#39;스위트홈&#39; 반응. &quot;한국 드라마 때문에 일상생활을 할 수가 없다&quot;,yKb-5vzTLtk,<class 'datetime.date'>
1331,"[해외반응] 미국의 할렘에서 한국의 교육이 일이키고 있는 기적, 하버드 합격까지? [코리아타임즈]",WntgVS7CoCw,<class 'datetime.date'>
1332,|중국반응| 中:&quot;중국이 하니까 한국도 할 수 있다는 거야?&quot; 한국 KFX 스텔스기 새 이미지 공개! 중국 젠20에게 어떠한 의미가 될 것인가...,0qxz8XwSLGA,<class 'datetime.date'>
1333,"[일본반응] 국민성 타령 | 백신 조기 확보를 자랑하며, 늦어진 한국 조롱하던 그들의 반응이 바뀌었다.",VWD_hhiTls0,<class 'datetime.date'>
1334,[일본반응] 한국이 압도적으로 잘나가자 태세 전환해버린 일본인들. &quot;왜 일본 음악은 한국에 완패한거야?&quot; 혐한들마저 분석하는 상황,Ik7El1199s0,<class 'datetime.date'>
1335,[일본반응] 제품불매운동에 결국 한국 떠나는 일본 자동차 기업 적자 규모가 ㅎㄷㄷㄷ 전세계 30여개 국에서 구조조정 중,yEkYxW6dAeI,<class 'datetime.date'>
1336,"한국 자동차 도로 놀라워 아무도 몰랐던 중앙선의 이것, 네티즌 해외반응 전 세계 외국인반응",Ja0YrDBOU78,<class 'datetime.date'>
1337,한국 전래동화를 본 외국인 해외반응 전세계 네티즌 반응,LlQzkWAZFaU,<class 'datetime.date'>
1338,[일본반응] 한국드라마 &#39;스위트홈&#39; 일본에서 큰 인기! 일본 SNS 반응. &quot;일본드라마와 수준 차이가...&quot; &quot;칼잡이 국어교사 멋있다!&quot;,CE9tRQDq2MY,<class 'datetime.date'>
1339,&quot;우리가 한국에 돌아온 이유!! 너넨 XX 미쳤어!&quot; 한국팬들의 소름돋는 떼창에 반한 해외가수들 모음 3편!,cUQXOYXBT2c,<class 'datetime.date'>
1340,[Eng] 외국인이 랜덤채팅에서 한국패션을 만났을때 반응 ?! : Random Chat with Handsome Korean. KKANG stylist,yvAUzHSNTUw,<class 'datetime.date'>
1341,[일본반응] 한국에 대해 영잘알 일본인이 느끼는 솔직한 일본반응 해외반응 EP.09ㅣ엔구 원정대,b2vMZb3r4gk,<class 'datetime.date'>
1342,"한국 사람들은 서양인의 나이를 맞출 수 있을까? (반응, 나이, 외국인, 리액션 ) │우리들의이야기 [ENG CC]",6LrPsLqBHRM,<class 'datetime.date'>
1343,한국 국밥 먹고 감동한 필리핀 직원?! 이런 반응은 처음 ㅋㅋ 전생이 한국인??,vVIVtw73ESY,<class 'datetime.date'>
1344,중국반응│한국과 일본 경제를 비교하는 뉴스에 나타난 친한파(亲韩派) 중국 네티즌들│한국이 이미 일본을 넘었는데 뭐라는거야│중국어로[路],pOtPBFag8wM,<class 'datetime.date'>
1345,"[해외반응]한국치킨을 맛보고 충격받은 외국인 반응, 해외에서 난리 난 한국 치킨[코리아타임즈]",CIl2otSlKIw,<class 'datetime.date'>
1346,중국반응│한국에 대한 거짓뉴스와 선동 당하고 있는 중국인들에게 날리는 일침│한국인들은 자신의 것을 아끼고 소중이 여긴다│참교육 사이다 뉴스와 댓글반응│중국어로[路],RssKR3uWeiM,<class 'datetime.date'>
1347,&#39;욱일기&#39;의 실체를 안 외국인들의 엇갈린 반응! 일본이 책임지고 청산해야 한다? | #외계통신 #사피엔스,pxPb2F15GSk,<class 'datetime.date'>
1348,한국인이 되고 싶은 벨라루스 미녀? 하나뿐인 딸을 한국으로 보낼 때 부모님의 충격적인 반응...,Ecj3v1DVjgw,<class 'datetime.date'>
1349,"&quot;한국 중심으로 뭉치자&quot;는 영국과 미국, 그리고 독일과 러시아 등 강대국들의 새판짜기 돌입에 당혹감을 감추지 못하고 있는 일본상황",03D5tQq2p8U,<class 'datetime.date'>
1350,"[일본반응] 출장 왔다가 돌아가기 싫다는 일본인 &quot;그냥 한국에 눌러앉아 살고싶네, 일본은 한국보다 나은점이 없어&quot;",zj523Y0cBkw,<class 'datetime.date'>
1351,일본편의점 한국음식을 처음 먹어본 일본여자 반응!? [ 한일커플 한일부부 ] 외국인,NinsY4oeVXI,<class 'datetime.date'>
1352,&quot;한국의 저곳 대체 뭐죠??&quot; 평범한 한국의 사진에 충격받은 외국인 반응 // &quot;전 세계에서 한국만이 가졌다&quot; [해외반응],kseCbgS1pcY,<class 'datetime.date'>
1353,"&quot;한국은 이렇게 한다고??&quot; 한국에서 찍힌 사진 한장에 전세계,충격 // &quot;전 세계에서 한국만이 가능한거였네..&quot; [해외반응]",dzGPE3UM3-k,<class 'datetime.date'>
1354,이란 유조선 나포! 청해부대 최영함 파견! 한국 군대 해외반응 어떨까? #이란유조선 #최영함 #청해부대 #해외반응,NgDhlLhanzc,<class 'datetime.date'>
1355,"[일본반응] 한국 김치수출량의 절반을 차지하는 일본 국민들의 반응 &quot;김치는 이제 일본의 국민반찬이야, 한국산은 품귀현상까지 생겼다&quot;",Dl3FOitl5a8,<class 'datetime.date'>
1356,겨울엔 뜨끈한 국물 최고♥ 깍두기랑 환상궁합 설렁탕 vs 입에서 살살 녹는 갈비탕 l #어서와K맛스타 l #어서와한국은처음이지,SuwtobnvdcI,<class 'datetime.date'>
1357,[해외반응] 외국인들이 한국 왔다가 깜짝 놀라는 한국인들만 갖고있는 특징 [코리아타임즈],i7IO4ekelp0,<class 'datetime.date'>
1358,[해외반응] 외국인들이 말하는 한국영화가 헐리우드보다 나은 이유,1mfJ7dqN4BU,<class 'datetime.date'>
1359,[단독외국인반응] &quot;한국에서 그곳만은 절대 가지마!!&quot; 한국 새벽 골목 영상에 외국인들이 경악하는 이유,zy60iBoTryM,<class 'datetime.date'>
1360,"[일본반응] 차량용 반도체 부족해 한국에 매달리는 일본 &quot;이러다 닛산과 혼다가 망하겠어, 한국에 체면 차릴 때가 아니다&quot;",zvf5ijZtJJs,<class 'datetime.date'>
1361,[일본반응] 한국 1인당 국민소득(GNI) G7국가 이탈리아를 넘어섰다! 일본네티즌 열등감 폭발! 인정하지 못하고 질투 가득한 일본반응,zldx4BrdIUA,<class 'datetime.date'>
1362,"[해외반응][일본반응] 이란 한국 유조선 나포! 세계 네티즌은 어떻게 생각할까? 일본반응, 중국반응, 이란반응, 미국반응",8VtFYtd2IVE,<class 'datetime.date'>
1363,"[일본반응] &quot;한국, 우리가 생각하는 것보다 훨씬 대단한 나라잖아? 왜 일본만 인정 못하는거야?&quot; 글쓴이의 팩폭에 진심 토로하는 일본 네티즌들",nfN4SeR7R_0,<class 'datetime.date'>
1364,한국산 김을 일본인보다 더 많이 먹는 미국인들 - 세계인의 수퍼푸드 우리나라 김(해외반응),jcNkaPvCtxM,<class 'datetime.date'>
1365,"[일본반응] 세계 전기차배터리 Top5에 한국기업이 3곳이나? LG화학, 삼성SDI, SK이노베이션 성장에 일본반응 &quot;한국기술의 원조는 일본이다&quot;",2Z7X-VqDPS0,<class 'datetime.date'>
1366,"[일본 반응 한국의 KFX는 조립 최종단계에 등극했다! 대한민국의 5세대 스텔스 전투기! 통쾌한 대반전, 놀라운, 상황.",OBXf13t4Z0M,<class 'datetime.date'>
1367,[단독해외반응] &quot;이래도 한국이 선진국이 아니라고?&quot; 한국인이 은행에서 하는 행동 보고 충격 먹은 외국인반응 모음,KUGoU7PLONk,<class 'datetime.date'>
1368,[일본반응] &quot;분하지만 일본 드라마는 한국에게 완패했다!&quot; 한국 드라마는 모든게 완벽하다며 감탄하는 일본 네티즌들,5Q4Cn6Su-yk,<class 'datetime.date'>
1369,&quot;전 세계 한국 드라마에 열광&quot; 경이로운 소문 난리 난 외국인 반응 // &quot;건강에 해롭다 못 벗어 나겠어&quot; [해외반응],H9SgjNav-GE,<class 'datetime.date'>
1370,[해외반응]해외 뉴스까지 보도된 한국의 도로 사진에 전세계가 놀란 이유 [코리아타임즈],Eif5BjQD6lo,<class 'datetime.date'>
1371,[일본반응] 확진자 8천명 나오자 한국에 사과하는 일본인들 &quot;이제 한국에 무릎을 꿇어서라도 일본을 탈출해야한다&quot;,lUKK1kXG7Rw,<class 'datetime.date'>
1372,&quot;한국에서는 안 훔쳐 간다고??&quot; 한국의 평범한 사진에 충격받은 외국인들의 반응 // &quot;한국이 세계1위인 이유가 있네&quot; [해외반응],FrqoKipDxFE,<class 'datetime.date'>
1373,[일본반응] 주민등록등본 발급에 5시간 걸리는 일본인들 &quot;한국은 인터넷으로 5초면 되는데 일본은 본적지까지 직접 가야하네&quot;,VSp86Xj7zN4,<class 'datetime.date'>
1374,"[남미반응] 역사적인 기록: 한국의 인공태양, 세계 첫 1억 도 20초 유지",vOLoyRuS8yQ,<class 'datetime.date'>
1375,[일본반응] 한국 해외건설 수주 38조 3천억 달성 5년간 최대실적,pxc7q8_YF5w,<class 'datetime.date'>
1376,(중국반응) 스위트홈 기록 또 경신! &quot;한국 드라마때문에 뜬눈으로 밤을 새고있어&quot;,xs_CIZjEaWo,<class 'datetime.date'>
1377,인간이 해낼 수 있는 일이 아니다!! &#39;올포디움&#39; 대기록을 완성한 김연아 소치 동계올림픽 해외 코멘터리,sOmynJoLpJE,<class 'datetime.date'>
1378,[일본반응] 한국은 이런것도 자동이야? 일본인들이 제발 일본에도 만들어 달라며 경악한 &#39;이것&#39; 지금까지 왜 이런 발상을 못했을까? 한국인은 정말 천재적이다&quot;,BjIiBxgIHKY,<class 'datetime.date'>
1379,&#39;이것이 한국 축구 클라쓰&#39;! 두 명의 &#39;정환&#39;이 만든 역대급 원더골,lWxMVnm99pE,<class 'datetime.date'>
1380,"[일본반응] 한국. K2 흑표전차 해외수출! 동유럽 체코 놀라운 가능성! 세계, 한국군.군사력",HNO66aiPPXQ,<class 'datetime.date'>
1381,[일본반응] 분하지만 일본 우익 매체마저 어쩔수없이 한국 제품에 최우수상을 준상황 &quot; 불만이 있는 일본인은 후지쯔든 소니든 직접 만들어봐라 기술도 없으면서&quot;,AFFYLjVA8hQ,<class 'datetime.date'>
1382,[일본반응] 위기를 극복중인 한국. 긴급사태를 선언한 일본. &quot;이것이 국가 지능의 차이&quot;,GAgJRmIOJes,<class 'datetime.date'>
1383,[일본반응] 일본이 원조였지만 한국이 90% 점유율을 차지한 &#39;이것&#39;이 공개되자 짜증난 우익 반응 &quot; 일본은 원조 기술을 가졌으면서 한국에 시장을 다 빼앗기잖아&quot;,qodAybKPPe8,<class 'datetime.date'>
1384,|중국반응| 中:&quot;새로 드러난 한국의 야심찬 경항공모함 건조 계획!&quot; 이를 경계하는 중국 군사평론가의 분석과 전혀 예상하지 못한 중국인들의 뜻밖의 반응...,lLwuo5SlEOk,<class 'datetime.date'>
1385,해외반응-CNN 한국 기술력 보도 한국인은 IQ가 높아 - 한국인은 예의바르고 착해,rpO4nE-dO1g,<class 'datetime.date'>
1386,한국인들만 모르는 한국인만의 기괴한 특징! 오직 한국인들만 하는 유별난 행동  한국인과 외국인을 구분하는 방법은? [해외반응],UAcXR3Mxsmg,<class 'datetime.date'>
1387,[일본반응] 한국 7개월 연속 무역 흑자에 난리난 일본반응,o47-erMXdx4,<class 'datetime.date'>
1388,속보 쏟아진 한국 비난 “위안부 재판 일본반응” // 도리어 한국이 일본에게 돈을 줘야한다?,bpD22Z-PqgY,<class 'datetime.date'>
1389,[해외반응] 한국 80년대 사진 보고 해외 네티즌 &quot;패션 감각이 뛰어나!&quot;,5QN0iVFCyRY,<class 'datetime.date'>
1390,해외에서 뽑은 한국의 드림팀! 국뽕 차오르는 해외반응??,Bci-Fd9-wsw,<class 'datetime.date'>
1391,한국의 초고퀄 크리처물 스위트홈을 본 외국인들의 반응?!,ui0cF2U-X0Q,<class 'datetime.date'>
1392,&#39;카디비&#39; 뮤직비디오를 처음 본 한국인 남녀의 반응 | Y,ViYJChz4Iqo,<class 'datetime.date'>
1393,[해외반응]미국에서는 쓰레기로 만든다는 그음식! 한국에선 최고 선물!,y8VkVv4Q8Uo,<class 'datetime.date'>
1394,중국반응│한국과 중국의 삶의 질을 비교하는 중국인들│한중 경제 HDI 수치 임금 환경 등 다양한 비교를 하며 자괴감에 빠지는 중국인 댓글반응 │중국어로[路],g14X08cvlwQ,<class 'datetime.date'>
1395,&quot;일본인들 제발 정신 차려라!&quot; 한국 방문후 분노한 일본인의 후기 // &quot;한국인들의 기분이 이해가 되네...&quot; [일본반응],eboAWPIrqqc,<class 'datetime.date'>
1396,중국반응│한국의 핵무기 개발 가능성 소식을 전하는 중국언론│한미동맹과 한국의 핵무장을 바라보는 중국 댓글반응│한국정도면 하루면 만들어낼 듯│중국어로[路],US-rMMdIZ8k,<class 'datetime.date'>
1397,한국의 빠른 일처리 속도에 감동한 외국인들 반응! 모바일 신분증이 도대체 뭔데?,0MCzEnNLEfY,<class 'datetime.date'>
1398,미국 부모님도 깜짝 놀란 한국 화장실을 본 미국인 반응,NzgV5mtYQgA,<class 'datetime.date'>
1399,"[일본반응] 군사력에서 한국에 따라잡혀 경악한 일본 &quot;인구 두배인데 군사력은 같다니, 사실상 한국의 절반수준이잖아&quot;",zKDwrGxzZ5w,<class 'datetime.date'>
1400,한국 음식이 이탈리아 마트에?! 이탈리아 사람들의 한류 열풍 반응이 정말 대단하네요...,ENaMRLU8m6c,<class 'datetime.date'>
1401,&quot;한국 수돗물은 최악이야&quot; 해외에 올라온 글에 외국인이 분노한 이유 // &quot;한국 수질좋아서 깜짝 놀랐는데?&quot; [해외반응],mzzwz7STANk,<class 'datetime.date'>
1402,"&quot;한국이 최고로 좋다&quot;는 미국 원내대표의 작심발언에 깜짝놀란 일본반응과, 한국의 놀라운 보건시스템에 감탄쏟고 나선 독일과 영국, 그리고 스페인 상황",5lzq6D3Ug3k,<class 'datetime.date'>
1403,[대만반응] 대만은 한국을 반드시 이긴다는 대만의 TV광고. 이렇게 직접적인 광고가 TV에 나온다고? 한국은 꼬리라는 광고에 대만반응. 해외반응,cVNV-e36ols,<class 'datetime.date'>
1404,대만방송에서 &quot;한국을 제일 좋아한다&quot;고 말하는 외국인들,VGUMbj-RR5c,<class 'datetime.date'>
1405,한국 떡볶이를 처음 먹어본 동네 아줌마들의 반응은??| 베트남 하롱베이 일상,19UhCe9ubIM,<class 'datetime.date'>
1406,[해외반응] 한국의 외국인 민박집 윤스테이가 진심 부럽다는 중국,zQYzrllzUs4,<class 'datetime.date'>
1407,&quot;도대체 한국엔 왜 오려는 거야?&quot;라는 질문에 외국인들 반응 폭발. &quot;한국인들은 아무리 설명해도 자신들이 가진 것에 대해 고마워할 줄 모른다&quot;,G7ZZgK_LWj0,<class 'datetime.date'>
1408,한국에서 딸의 출산장면을 본 러시아 장모님의 반응..,_yLDxJ78CqY,<class 'datetime.date'>
1409,&quot;겨울에 한국이라 행복하다&quot; 해외에 올라온 글에 일본을 분노하게 만든 이유 // &quot;다 사실인데 왜 화내는 거야?&quot; [해외반응],AMI5BuzaWnc,<class 'datetime.date'>
1410,[일본반응] 구글트렌드로 드러난 한국에 대한 일본의 관심. 한국보다 일본이 더 관심가지는 현실에 일본반응,hSWMgxW4wDc,<class 'datetime.date'>
1411,한국급식 해외반응 이게 급식이라니 믿기지 않아! 외국급식은 어떻길래,PUC4JbtVRpQ,<class 'datetime.date'>
1412,"일본 반응l 한국이 현무미사일 SLBM 잠수함을 개발하자, 깜짝놀란 일본! 세계군사력, 대한민국군!",Hb896mueQa0,<class 'datetime.date'>
1413,폭설에 초토화된 한국 위성사진에 찍힌 기괴한 틈새에 해외네티즌 집단실신한 이유 &quot;한국인은 진짜 미친게 틀림없어&quot;,GtKILp_8hE4,<class 'datetime.date'>
1414,"(해외반응) 한국의 촌스러운 아이템은 외국인에겐 인기템! 외국인에겐 혁명이다!! 호미, 갓, 담요, 포대기 아마존에서는 없어서 못팔아요.",EFr2WtnICts,<class 'datetime.date'>
1415,[일본반응] 이제 일본 김은 못 먹겠다 한국 김 대박 나자 한국 김은 인정할 수 밖에 없다는 우익들 &quot; 한국 운운하기 전에 한국 김이 압도적으로 맛있는 게 사실이야&quot;,_uSyeLlyvMQ,<class 'datetime.date'>
1416,&quot;한국으로 다시 돌아가야만 해&quot; 한국 후기 글에 외국인들이 절규한 이유 // &quot;이제 한국인들의 마음이 이해가 되네...&quot; [해외반응],yIncXezxSv0,<class 'datetime.date'>
1417,[경이로운 소문 해외반응] 미국 고등학교 친구의 리얼 한국드라마 반응,w8oibbuJ-jU,<class 'datetime.date'>
1418,&quot;한국이 미국의 대기업을 쓰러뜨렸다고??&quot; 한국의 기술력에 외국인들의 충격적인 반응 // &quot;전 세계 인구의 반이 쓰고 있다니..&quot; [해외반응],nw5_xd7N00I,<class 'datetime.date'>
1419,(일본반응) 부정해도 증명되는 한국드라마의 인기 / 사랑의불시착 일본인반응,clWiYMrU63Y,<class 'datetime.date'>
1420,"|중국반응| 중:&quot;대국인 중국이 한국보다도 뒤라고??&quot; 2021 헨리 여권 지수 한국 3위, 중국 70위... 이에 남겨지고 있는 부러움과 애잔함이 공존하는 반응들...",c2i7nfkT-XA,<class 'datetime.date'>
1421,&quot;한국은 똑같이 당하는 거다&quot; 최근 이슈에 대한 일본반응에 외국인이 경악한 이유 // &quot;한국이랑 중국이랑 똑같다고?&quot; [해외반응],PY2HMOT-aaQ,<class 'datetime.date'>
1422,[해외반응]한국이 개발한 새로운 과학기술에 과학계가 발칵 뒤집혔다[코리아타임즈],fsxY2YW5Aus,<class 'datetime.date'>
1423,[일본반응] 코로나 세계철강 불황에도 2배 성장한 한국기업에 일본반응! 국내에선 관심도 없는 기사가 일본에선 큰 관심받고 있는 상황,zDeWtnw5UFg,<class 'datetime.date'>
1424,[일본반응] 한국이 국민 총소득(GNI) 에서 G7인 이탈리아를 최초로 넘어서자 엄청나게 흥분한 우익 반응 &quot; 이게 일본인에게는 이 정도로 화가 날 일인가?&quot;,NAlYJlJTuHI,<class 'datetime.date'>
1425,"[일본반응] 삼성폰에 日부품 안들어가자 일제 써달라는 반응 &quot;일본은 한국 없으면 안되는구나, 이러다 하청기업들 다 망하겠어&quot;",AeExTb06vNE,<class 'datetime.date'>
1426,[중국반응] [대만방송] 한국먹방 유튜버와 일본먹방 유튜버가 중국네티즌에게 당한 어이없는 일. 중국반응을 보면...이래서 다들 유리멘탈...유리멘탈 하는구나...,-mVTHFBlUEI,<class 'datetime.date'>
1427,중국반응│전세계로 퍼지고 있는 한국에 대한 왜곡된 사실과 역사│한류와 심지어 태권도까지 왜곡된 사실│중국의 역대급 망언과 중국인 댓글반응│중국어로[路],KGDCIXyzih0,<class 'datetime.date'>
1428,[런닝맨] 김종국을 갑자기 마주했을때 리얼 반응 | RunningMan EP.104,kPsA1jO-M0E,<class 'datetime.date'>
1429,[페루반응] 한국으로 수출되는 자국 망고 소식에 애국심 터지는 페루 네티즌들,mMXnD7sRIBE,<class 'datetime.date'>
1430,"[일본반응] 한국의 K2 흑표전차와 K9자주포, 군사력 순위! 세계최강 기갑부대! 한국군 무기!!",fijbfP-JC-g,<class 'datetime.date'>
1431,[일본반응] 한국선박수주 세계1위! 중국을 제치고 세계점유율 43%에 일본반응,s-NfnQ44PAo,<class 'datetime.date'>
1432,[일본반응] 일본이 아직도 부자라고 믿는건 착각. 이제 한국보다 못하다는 기사에 일본 커뮤니티 반응 &quot;이제 인정하자&quot; &quot;한국은 성장하는데..&quot;,u_i9wqMzumk,<class 'datetime.date'>
1433,"[일본반응] 미사일구축함 고구려 광개토전투함 ! 한국해역 EEZ 침범한 일본을 침몰시킨다, 세계군사력 한국군 무기!!",U1sMMDFCHbA,<class 'datetime.date'>
1434,"[중국반응] [영상번역] 빡치는 한국역사관을 가진 중국인 평론가. 그가 김치, 한국역사를 난도질하고 역사왜곡하는 이유!",eNz1RXtFL4c,<class 'datetime.date'>
1435,"[일본반응] 한국드라마 기사에 달린 일본인의 한결같은 반응. &quot;한국드라마를 보게 된 이후, 일본드라마는 쳐다도 안봐!&quot; &quot;너도?&quot; &quot;어, 나도!&quot;",br_jaYTT-WY,<class 'datetime.date'>
1436,[일본반응] &#39;스위트홈&#39; 드라마 평가 사이트 반응 &quot;한국이니까 가능한 작품&quot; &quot;이건 드라마 수준이 아니야!&quot;,liTIo5hYAME,<class 'datetime.date'>
1437,|중국반응| 중:&quot;자동차 강국 한국에 가서 도장깨기 하나?&quot; 중국의 롤스로이스로 불리는 홍치 H9 한국 상륙! 한국에서의 인기 가능성 질문에 남겨진 중국인들의 반응은?,mRIsL4omWv8,<class 'datetime.date'>
1438,[COVID-19] 국내 코로나19 백신 접종 계획,HQPqH13vtEg,<class 'datetime.date'>
1439,[해외 반응] 한국 치료제 임상시험 승인 입원기간 단축 &amp; 사망률 제로 일본인네티즌 &quot;수출하지마!&quot;,6L-ALktUaIg,<class 'datetime.date'>
1440,[해외반응] 한국 영화계에 완패한 일본 일본인네티즌 &quot;쓰레기다!&quot;,gZvD_vdB3yE,<class 'datetime.date'>
1441,[해외반응] 한국의 벽지 사용 해외네티즌 &quot;왜?&quot;,Z6j7H3tkt3Y,<class 'datetime.date'>
1442,[해외반응] 한국 &quot;종양 제거 기술 개발&quot; 해외네티즌 &quot;글쎄..&quot;,RkJqYu03B_s,<class 'datetime.date'>
1443,중국반응│생생한 한국생활 후기를 본 중국인 리얼 댓글반응│놀라운 한국의 생활환경과 복지제도│한국가서 살고 싶다│​중국어로[路],YVXPQ1JQN7I,<class 'datetime.date'>
