,title,video_id,date
570,[일본반응] 한국영화가 넷플릭스 글로벌 1위하자 우울하다는 일본반응 &quot; 왜 일본영화는 한국에 졌을까? 너무 우울하다&quot;,ihqv4dJcR5o,<class 'datetime.date'>
571,[해외반응] 외국인들이 한국에 여행하러 한번 왔더니 다 다시 한국 갈래로 도배됐다! 한국의 다양한 특징에 대한 극찬 &quot;일본보다 좋아하네&quot; #한국#한국반응#해외반응,X1zYdfcIYaA,<class 'datetime.date'>
572,[해외반응] 한국에 살다가 미국에 다시 돌아와서 뒤떨어지기 된거같아! 미국네티즌 한국마트의 딱 한장만 봐서 입틀막 &quot;한국 대단해!&quot; #한국반응#해외반응,YHd8SunU32g,<class 'datetime.date'>
573,[일본음식] 일본혐오음식 &#39;한국반응&#39; 길거리 먹방테스트,tOLLgfv_vXU,<class 'datetime.date'>
574,"한국 헬스 문화 vs 미국 헬스 문화, 미국 헬창의 반응은?",WsAIV0ufFrE,<class 'datetime.date'>
575,"(해외반응) 한국 핫도그를 먹어본 외국인들이 한 말, 극찬하는 한국 음식 &quot;역시 한국 사람들은 뭘 좀 아는군!&quot;/해외 네티즌 반응",LFnJWnCXKAQ,<class 'datetime.date'>
576,외국 음식 처음 먹어본 미선 보스 반응은?? 해외 음식 직접 가서 먹어봤습니다✈️,IW2sUnFCWtc,<class 'datetime.date'>
577,[해외반응] 한국이 전세계 팬데믹 상황에서 세계를 놀라게 한 일들 TOP3,FQ_pnLAtkI4,<class 'datetime.date'>
578,(외국인댓글)한국드라마에 빠져드는 일본남자들 반응/일본여자 취향과는 근본적으로 다르다구  #외국인댓글 #댓글모음 #네티즌반응,VJToNU08ATI,<class 'datetime.date'>
579,"RIMPAC 미해군 핵항모 등 15척 전멸, 세계 최강 반열에 등극한 한국 해군의 잠수함",FF7xu8PnwJ8,<class 'datetime.date'>
580,인도네시아 &quot;한국 잠수함은 쓰레기라며 폭풍오열 &quot;현지반응이 더 대박,XrB76qqzj64,<class 'datetime.date'>
581,[일본반응] 원래 한국의 자리는 일본꺼였다며 한국에게 위상을 빼앗긴게 분하다는 일본 반응 &quot; 한국에게는 평생 못이길것 같다 이제 일본이 한국을 배울차례야 &quot;,UdjyjM46TVg,<class 'datetime.date'>
582,(외국인댓글) 나의 아저씨에 대한 외국인들의 평가 /한국 드라마 중 최고가 아니라 그냥 최고 드라마다  #외국인댓글 #외국인반응 #나의아저씨,LDd0dWW3vWc,<class 'datetime.date'>
583,▶[일본반응] 한국이해냈다 반도체 핵심장비 국산화성공 &quot;일본 제조업은 완전히 망할 수도 있다&quot;,xhkuR84fAVA,<class 'datetime.date'>
584,"[단독해외반응] 해외에 올라온 충격의 사진 한장, 한국 XX에서만 볼 수 있는 &#39;이것&#39;의 정체??",IMxJ1Dv_qbE,<class 'datetime.date'>
585,갯장어에서 잔디 맛이!? (리얼반응ㅋㅋ) l #어서와한국은처음이지 l EP.157,KgKaBXn9BTA,<class 'datetime.date'>
586,[중국 반응] 베트남이 한국형 전투기 KF-X의 도입한다.한국이 자주국방에 성공하고 메이져 무기 수출국이 된다는 미국의 전망 이유!,cfuSIue_XoU,<class 'datetime.date'>
587,[한일부부/ 日韓夫婦]한국 일본가족 집안 여자들 선물 반응/日韓家族の女の子たちのプレゼント反応/일본에서 넘어온 선물/日本から来たプレゼント/무한감동/감사합니다/感動/ありがとうございます,duF3JPeUa2E,<class 'datetime.date'>
588,[해외반응] 코로나 시국에 해외에서 불티나게 팔리는 한국 과자들! 한국 과자 너무 맛있어!,MWnqzFWDw1g,<class 'datetime.date'>
589,서울 지하철 놀라운 사실들! 한국 지하철 타 본 외국인 해외 반응 총정리[월드 리액션],PfXRaenQV3w,<class 'datetime.date'>
590,"[해외반응] 항공모함, 드라마, 예능부터 이제 과자까더도 한국 표절하는 중국인들...해외여론도 분노 &quot;왜 그렇게 뻔뻔하냐? 미친 중국을 막아야 한다&quot;! #한국#한국반응#해외반응",Fmya8W2mkQ0,<class 'datetime.date'>
591,✅시진핑 한국 무시하다가 바짓가랑이 붙잡은 상황#한국#외국인반응#일본반응#현지반응#세계반응#중국반응#공산당#시진핑#태국#필리핀#미국#트럼프#대만#인도#삼성#습근평,U_CowUYHkLA,<class 'datetime.date'>
592,눈물 줄줄 + 깜놀!! 한국영화 &#39;수상한 그녀&#39;를 본 일본인의 반응은? #한일커플 #한국영화 #수상한그녀,uuVMR6ACcwY,<class 'datetime.date'>
593,-일본반응- 한국 삼성이 베트남을 정복 이것이 한국의 능력인 이유 강대국 한국인 영향력은 상상이상 ! 대반전 세계 경제 박항서 해외반응,oFHfW0lwRmo,<class 'datetime.date'>
594,"[일본반응] 한국과 갈린 현실에 이해 못하겠다며 일본 민심이 대폭발한 이유, &quot;먹는것 조차도 한국을 이길 수 없다니&quot; 1년간 해결하지 못한 사고가 터져버린 상황 반응",X7C8CCgeRJk,<class 'datetime.date'>
595,[일본반응] 정은경 본부장이 청장으로 승격하자마자 한국에 경사가 나는 상황!,2xOQ_GFUhyg,<class 'datetime.date'>
596,미방분! 💙문 대통령과 눈마주친 BTS 반응💜 리허설 중인 BTS! 문재인 대통령 연설까지 담은 제1회 청년의 날 기념식 문워크 버전 + 뒷 이야기는 본문 텍스트로 확인!,5gM_wFCB7gI,<class 'datetime.date'>
597,"잘생긴 한국남자 연예인을 본 이탈리아 여자 반응,나이 맞추기 | 소피랑",wcvwnDrum3E,<class 'datetime.date'>
598,[일본반응] 한국돈 갈취하려다 강경화 장관의 폭탄발표에 벌어지는 상황!,qmOSKMAkbYk,<class 'datetime.date'>
599,[일본반응] 일본이 &#39;전세계가 한국을 떠나고 있다&#39; 헛소리를 내자마자 해외여론에게 때렸다...1위 노예국가는 일본이다! 정신차려라 #일본반응#한국#한국반응#해외반응,EiEvx2Kr4nA,<class 'datetime.date'>
600,한국의 창의적인 욕을 들은 외국인의 반응!,ZD9-7ZNBJ7o,<class 'datetime.date'>
601,“너무 의외다” 넷플릭스 한국영화세계1위라고? 해외반응,jEToDLWDRtM,<class 'datetime.date'>
602,"한국 영화 &#39;베테랑&#39; 리메이크 한 중국 영화 화제, 중국인들의 반응",KKFxLLQyF80,<class 'datetime.date'>
603,한국의 근손실 시리즈를 본 미국 헬창의 반응?,cYKgE0qB_zA,<class 'datetime.date'>
604,WSJ &quot;한국이 코로나 대응 &#39;암호&#39; 풀었다&quot;…집중조명 / JTBC 뉴스룸,EftWhZ559I0,<class 'datetime.date'>
605,한국 여성 납치해 7시간 인질극 벌인 중국인과 한국 반응,4l8IslS0D3Q,<class 'datetime.date'>
606,"한국 넷플릭스 영화,드라마에 난리난 유럽 스페인 미녀 반응은?",e7w7_1ja23Q,<class 'datetime.date'>
607,"한국에만 나온 한정판, 카시나 덩크 외국인 반응 보기",39YIrJHQTIU,<class 'datetime.date'>
608,인생 첫 한국 음식먹고 이민 결정한 영국 대학생들?!? (요리 10개 클리어 실화?!),KL_rXhz08H4,<class 'datetime.date'>
609,한국의 엉뚱한 러시아어를 본 불곰누나들의 반응,SU9u0BchrJ4,<class 'datetime.date'>
610,대만반응│한국을 분석하며 애타는 대만 ep.2│한국은 지금 심각한 경제 위기│역시 한국 걱정해주는건 대만밖에 없네 ㅋㅋ│중국어로[路],09Litp9fXEQ,<class 'datetime.date'>
611,빨라도 너무 빠른 안경 만드는 시간☆_☆(대박적) l #어서와리플레이 l #어서와한국은처음이지 l EP.158,qAMUPMmworE,<class 'datetime.date'>
612,한국에서 온 엄청난 선물을 받은 영국 가족의 반응,0nw7OJ-VkSs,<class 'datetime.date'>
613,한국 과일을 처음 먹어본 외국인들의 반응,r-V8usVBfw4,<class 'datetime.date'>
614,[해외반응] 한국 학교의 균형 잡히고 맛있는 급식,Pxwaaam8zJU,<class 'datetime.date'>
615,[단독해외반응] 외국인이 올린 한국 밤 영상에 &quot;말도 안 되는 행동이다&quot;라며 충격먹은 해외 네티즌,7mrfd0ELHKY,<class 'datetime.date'>
616,&quot;한국인들은 먹는걸로 절대 못이겨!&quot; 외국인이 한국에서 다이어트를 포기한 이유 [해외반응],zsZyIdU7wGI,<class 'datetime.date'>
617,[중국반응] 중국인이 가장 높은 평점을 준 한국드라마 Top10..(인기가 아닌 작품성 기준으로 평가),AgW6t-2BAxI,<class 'datetime.date'>
618,[일본반응] 만약 한국과 전쟁하게 될경우 절대로 한국 못이긴다는 일본반응 &quot;아무리 봐도 일본이 이길수 있는 길이 보이질 않는다&quot;,2c6T30VIeWI,<class 'datetime.date'>
619,아일랜드 남자 셋이서 한강공원 즐기는 방법.mp4 l #어서와ZIP l #어서와한국은처음이지 l EP.111,b6JjSiR6un8,<class 'datetime.date'>
620,"이탈리아에서 한국의 기술력이 절실하다는 반응을 보이는 이유, &quot;한국이면 금방 끝낼일을...&quot;",D-fqaTBkC10,<class 'datetime.date'>
621,중국반응│한국 달래기에 애쓰는 중국 언론│손발 오그라들게 한국을 칭찬하는 중국│중국어로[路],9EgfOeE9UnA,<class 'datetime.date'>
622,[미국반응] 미국은 한국에 &quot;미스터 션샤인&quot;인가? K역사드라마를 본 미국반응! [PART1],q1lET-En-kQ,<class 'datetime.date'>
623,[해외반응] 해외네티즌들 한국은 총이 아니라 드라마와 음악으로 세계 통일을 이룩할거라고 인정! 미국이 발표한 한국영상에 전세계 눈물바다 &quot;한국 없으면 안돼&quot;#한국반응#해외반응,qQdQFsj6AN8,<class 'datetime.date'>
624,[일본반응] 미국에서 일본을 제치고 한국의 이것이 1위하자 발작하는 일본  &quot; 외국인들은 한국꺼 박스채로 사더라 일본은 완전히 한국에 졌어 &quot;,M31iCP-JiqE,<class 'datetime.date'>
625,[해외반응] 일본 살던 미국인이 한국으로 이민 온 6가지 이유!,CUHRhLRbJ_g,<class 'datetime.date'>
626,(일본 반응) 한국의 최첨단 가전제품 반면 일본제는 쓰레기 ! LG의 통쾌한 대반전 역습 ! 세계 해외수출 네티즌반응,3667j9_kV8M,<class 'datetime.date'>
627,[해외반응] WSJ이 한국의 K방역을 대서특필하며 극찬하자 미국 네티즌들이 보인반응 &quot; 한국은 다른 어떤나라와도 비교할수없는 국가 &quot;,omwiT5-CKxM,<class 'datetime.date'>
628,"[미국+일본반응]방탄소년단(BTS), 미국 안방까지 전달한 한국의 미, 경복궁에서 한복입고 역대급 IDOL 무대! &quot;그냥 봐. 이게 그들이 전세계 1위 그룹인 이유야&quot;",wEx5wWLb0C4,<class 'datetime.date'>
629,해외반응 일본네티즌반응 한국의 KFX 전투기 극초음속 미사일 무기개발 선진국 한국군! 일본은 깜짝놀란 이유 !,AVNRzkJPN2s,<class 'datetime.date'>
630,[일본반응] 세계 최강 한국의 현무4 미사일은 일본 열도를 초토화 ! 오직 한국만이 가능한 이유 한국군 대마도 전략거점 해외반응 K2 K9 KFX,uGdYdgK3cX8,<class 'datetime.date'>
631,"중국 축구, 한국 최강희 감독에게 빠지다! 감동먹은 중국 반응",-4O_h3fCHE0,<class 'datetime.date'>
632,(해외반응)세계인들이 본 한국 특수부대 실력 /많은 해외국가들의 인정/해외네티즌반응,Gq5T8RLrsmM,<class 'datetime.date'>
633,한국의 스텔스 구축함 KDDX 일본반응 비밀무기 첨단 기술력 개발 레이더 강대국 군사력 해외 네티즌 반응,Fop-IupqGsM,<class 'datetime.date'>
634,"[해외반응]이게 된다고? 한국 치안, 양심 경험해본 외국인 반응 레전드(feat. 노트북 실험 at 한국카페)",U4c5uAQLjR8,<class 'datetime.date'>
635,"“참 이상한 나라” 설민석, 대한민국은 위기 앞 단결력으로 똘똘 뭉치는 나라!ㅣ집사부일체(Master in the House)ㅣSBS ENTER.",xlohdnp3uoM,<class 'datetime.date'>
636,한국 치킨 처음 먹어본 영국 친구의 반응은..? // Korean Fried Chicken Reaction,2nzvZ9gv8Hc,<class 'datetime.date'>
637,(일본 반응) 한국의 K-2 전차 흑표와 비교하면 10식 전차는 쓰레기로 드러나 발칵뒤집힌 상황! 해외 네티즌반응,YjfS7gtiK30,<class 'datetime.date'>
638,"[해외반응] 전세계 미국, 일본, 유럽들보다 한국 자동차를 완전히 압도했다고 인정! 해외네티즌 경악 &quot;한국 차은 대세다! 일본커녕 미국도 졌어&quot; #일본반응#해외반응",gf_UNwv9-nM,<class 'datetime.date'>
639,"[일본반응]日 매체, 한국드라마와 K-POP에 이어 그 둘의 융합형인 드라마 OST도 인기 &quot;한국드라마 OST는 꽝이 없지&quot;",EAc5D3QQuoo,<class 'datetime.date'>
640,쿠바 지폐를 본 사람들 반응“한국 물건이 왜 여기있어?”/한국이 쿠바에 설치한 컨테이너“최소 수십만에게 빛을 줬다”,qTWyzT4Xqko,<class 'datetime.date'>
641,|중국반응| &quot;만두 원조는 우리 중국인데 수출은 한국이?...&quot; 비비고 만두 해외 수출 5천억 돌파! 전 세계를 휩쓸고 있는 한국 냉동만두!,R2aUWhqpcws,<class 'datetime.date'>
642,"&quot;예측할 수가 없는 투수예요&quot; 류현진, 주요장면 현지반응",ClvEZt5bifg,<class 'datetime.date'>
643,[일본반응] 그렇게 한국 무시하더니 이제와서 일제는 쓰레기라며 한국찾는 일본 &quot; 결국 일본도 한국 불매운동 했지만 완전 실패했네 &quot;,8uGCkQETryw,<class 'datetime.date'>
644,해외반응 일본 네티즌 반응 한국 K9 자주포 엔진 국산화 개발 무기 ! 국방 군사력 K2 흑표 전차 현무 미사일,ciWUzCY63_o,<class 'datetime.date'>
645,태국 처갓집을 오랜만에 갔는데 이런 반응이 나올 줄이야😓 | 한국 제품 생맥주 기계를 구입한 폴란드 장인어른,HIsFCNhF-XU,<class 'datetime.date'>
646,[해외반응]한국학교급식 균형잡혀있어 전세계에서 &quot;급식에 김치가? 우리아이들도 규형잡힌 급식 필요해 네티즌반응,KVut0ctXqjY,<class 'datetime.date'>
647,[일본반응] BTS 방탄소년단 &#39;타이니 데스크 콘서트&#39;에 출연! 한국 댄스 아이돌이 출연해서 깜짝!,CM1wsBBtRCg,<class 'datetime.date'>
648,일본아내가 한국남편 생일에 몰카! 반응은? [ 한일커플 한일부부 ],CVCJDhK1FCo,<class 'datetime.date'>
649,한국으로 유학온 외국인에게 코로나 물어봤을 때 반응,TMCJen3TE3Y,<class 'datetime.date'>
650,외국인 100명이 한국치킨을 처음 먹어본 반응은?? (스포일러: JMT),UlTpeWOqwsQ,<class 'datetime.date'>
651,해외에서도 인기! 한국의 핫도그 화제 + 해외 반응,6Zqc7SQ21yM,<class 'datetime.date'>
652,대만반응│대만 네티즌들의 대만 한국 비교│한국을 따라잡고 싶은 대만│한국의 경제 교육 문화 소질 모든 것이 부러운 대만│중국어로[路],vWPeAwfacs4,<class 'datetime.date'>
653,"한국은 어느새 미국, 일본, 유럽을 뛰어 넘은 첨단 선진국 - 빼박 증거들에 대한 해외네티즌 반응",hfp5f2wzuc4,<class 'datetime.date'>
654,[현지반응] 차붐 넘은 한국선수 빅리그 최다골 손흥민에 쏟아지는 찬사들,p3Bof7JaUE0,<class 'datetime.date'>
655,중국반응│한국영화를 부러워하는 중국인들│한국영화와 중국영화 솔직 비교│중국영화는 한국영화 따라잡긴 글렀어│중국어로[路],rCUUEbK6L8g,<class 'datetime.date'>
656,백예린 해외반응 영어 댓글 해석  &quot;한국에 갈 이유가 생겼다&quot;  | Tina from Korea,WkOVIDys-ZU,<class 'datetime.date'>
657,2020년 하반기 한국의 군사력 영상이 공개되자 해외반응이 대폭발한 이유. BTS까지 대반전 발칵 뒤집혔다.,_ALJOi0_nIo,<class 'datetime.date'>
658,한국 닭강정을 난생 처음먹어본 영국아저씨의 리얼반응,MmyW_7wQBUo,<class 'datetime.date'>
659,일본 반응 한국은 현무4 미사일 보유국 도쿄를 정복한다 세계 군사력 순위 대한민국 해외 네티즌반응,UfNHTIiT2JI,<class 'datetime.date'>
660,"(일본 반응) 한국, 현무미사일 아스널쉽 합동화력함 개발한다 세계 군사력!",S2OYt9FQsy0,<class 'datetime.date'>
661,[일본반응] 현재 일본에서 난리난 한국 연예인 심지어 그는 국보라는 일본인들 반응&quot;너무 잘생겨서 눈물이 나와 사람으로 보이지 않는다&quot;,mL_fTqBXxpU,<class 'datetime.date'>
662,▶[일본반응] 中언론&quot;한국 수출규제로 역풍맞은 일본&quot; &quot;일본청년들의 한국망명은 시간문제&quot;,GYaRbG4v4D4,<class 'datetime.date'>
663,(일본 반응) 한국의 미사일 핵잠수함 5년내 개발한다 대한민국 해군 군사력,BfbiXzwOi1A,<class 'datetime.date'>
664,한국 학교의 충격적인 졸업문화를 처음 본 미국인 반응,RDE_VnuK4rA,<class 'datetime.date'>
665,[해외반응] &quot;한국은 영화속의 나라야&quot; // 한국 버스정류장 사진에 해외에서 수입요청 쇄도하는 이유,WuVEq2gGkAw,<class 'datetime.date'>
666,태극기 휘날리며 우크라이나 반응!! 한국 전쟁 영화를 처음 본 외국인!,hnPibS7ZYMY,<class 'datetime.date'>
667,필리핀 집짓기 / 한국 핫도그를 처음 먹어본 아이들 반응,exiQg7JpAzc,<class 'datetime.date'>
668,".일본 반응. 한국의 통일 세계 2위 강대국 된다 짐로저스 초대박 발언! GDP,경제 순위",f6QyoSes-LY,<class 'datetime.date'>
669,K9 해외반응 혹한기 테스트 한국의 K-9 모든걸 만족했다.기대 이상 완벽하다,VePXYZ04e5o,<class 'datetime.date'>
670,[해외반응]리그오브레전드 한국용병의 중국어실력? 중국네티즌들의 반응입니다.,c2-Os4xbS_8,<class 'datetime.date'>
671,[해외반응]한국 디지털경쟁력 세계 8위. 일본은? 일본네티즌 반응입니다.,TfMEjkzujHw,<class 'datetime.date'>
672,{일본 반응} 한국은 반도체 장비 첨단 기술개발 국산화 노재팬 불매운동 세계 경제순위 삼성,1ss_l_WtbxA,<class 'datetime.date'>
673,▶[일본반응] 2020노벨상 &#39;화학상&#39;한국인 후보 &quot;한국이 수상하면 일본은 그때부터 몰락기&quot;,cSKhhuP5szU,<class 'datetime.date'>
674,"[해외반응] 독일 국방 책임질 차세대 무기에 한국제 결정 한국과 UAE가 잔뼈 굵은 강자를 능가한 이유, 핀란드도 대만족하며 한국제로 구매한 상황 메이드인코리아가 유럽에 상륙 반응",CXsyNIjsV3E,<class 'datetime.date'>
675,|중국반응| &quot;폐허에서 선진국까지...&quot; 50년 만에 한국이 선진국이 되기까지 중국이 주었다고 말하는 도움은 어떤 것들이 있을까...,vBQBOHQO62U,<class 'datetime.date'>
676,"한국 &#39;라면&#39;을 먹어본 외국인들의 반응 &quot;침이 고여&quot; 먹방 대표음식 라면 해외반응, 외국인반응, 댓글모음",ydmB-KMUdoI,<class 'datetime.date'>
677,"[미국+일본반응]BTS WEEK, 신비롭기까지 했던 블랙스완 무대, 한국의 무대 세팅과 연출에 감탄 연발! &quot;완전 자기들만의 리그서 노네&quot;",UJ01qzcQZK4,<class 'datetime.date'>
678,"한국 LCK 무시하고 다 따라잡았다던 로그 경기 전후 반응 모음, 징동 담원전 패배후 인터뷰 【제이정】",RgOm-6Msdh4,<class 'datetime.date'>
679,[BANGTAN BOMB] &#39;Dynamite&#39; Stage CAM (BTS focus) @ Gyeongbokgung - BTS (방탄소년단),nF1zZIETE5k,<class 'datetime.date'>
680,"[중국반응] 손흥민은 한국의 우레이야, 토트넘 손흥민 맨유전 2골 1도움 개폭발",ZUuyNclmIG0,<class 'datetime.date'>
681,[어서와 한국] 2020 한국지하철의 외국인 반응/세계 최고의 지하철은? /한국지하철 세계 순위는? /외국인이 타본 한국/서울지하철 소감,Lylz4slb7s8,<class 'datetime.date'>
682,"▶[일본반응] 스위스IMD발표 세계디지털경쟁력 한국8위 일본27위 &quot;완전 실패, 일본인으로서 부끄럽다&quot;",AfX-QWJyv-k,<class 'datetime.date'>
683,"한국 잠수함 전력 급상승에 배 아픈 일본 매체의 반응! 미국 경고, 한국을 만지지 마십시오. 한국은 성공적으로 핵 잠수함을 구축",oWcgMLFGDLE,<class 'datetime.date'>
684,"|중국반응| &quot;한국, 미국, 독일, 일본...&quot; 대표 자동차 생산국들을 합한 것보다 많이 생산한다며 가성비 최고를 외치고 있는 중국자동차???",D4ALTY7RkMg,<class 'datetime.date'>
685,"▶[일본반응] 日&quot;한국은 빵, 김치, 물만 먹고산다&quot; &quot;더 가난한 일본이 걱정해주는 어색한 상황&quot;",2Ya2mG6jVUg,<class 'datetime.date'>
686,"코로나, 한국처럼 했다면 미국 경제가 좀 나았을까? | 해외반응",3adW33ATFXw,<class 'datetime.date'>
687,한국 군대리아를 처음 먹어보는 외국인 반응🍔(자막✔)ㅣ모든 대한민국 군인 여러분들께 감사한 마음을 전합니다ㅣ국군의날 72주년👏👏👏,qQ6fAR5o858,<class 'datetime.date'>
688,[충격][일본반응] 바다에서  압도적 1위는 물론 한국이었다!  일본조선업계는 더이상 한국 조선기업들과 비교대상이 아니게 될 정도로 크게 몰락하는 이유!,ufZ8rZpno8A,<class 'datetime.date'>
689,해외에서도인기!한국의핫도그화제+해외반응,NQP2mgWb0xo,<class 'datetime.date'>
690,일본의 반응! 한국은 쓰시마 대 미사일 기지를 배치합니다. 독도 독도 장미! 전례없는 핵무기 인 한국군이 드디어 등장!,UXmBBvY_-yY,<class 'datetime.date'>
691,[이슈톡] 아르헨티나 육군 &#39;최신 무기&#39; 공개 (2020.10.05/뉴스투데이/MBC),kxJ6m8WCDLE,<class 'datetime.date'>
692,🔥 10000칼로리🔥+5kg _[자메이카통다리+치밥.뿌링클.짜파게티+소세지.떡볶이+순대+튀김+꼬마김밥.치즈케이크.불닭스피게티+삼각김밥+모찌롤케잌.비빔면+삼겹살],FY55-d7O5Ho,<class 'datetime.date'>
693,"노블스타의 미니선물 지지저항선 활용법, 해외선물의 기본,  미니항셍, 미니나스닥, 마이크로항셍, 마이크로나스닥",A74IdpgzcIA,<class 'datetime.date'>
694,k2소총~AWM저격총리뷰,7StymmwlvqU,<class 'datetime.date'>
695,한국 꽃등심을 처음 먹어본 영국 축구선수들의 반응?!,sy9Gh-qEqAc,<class 'datetime.date'>
696,한국의 헬창시리즈를 본 미국헬창 반응은?,Ccww8eLYgcI,<class 'datetime.date'>
697,"생일 선물 반응,  구독자 선물 오픈, 한국선물 언박싱, 외국 선물 반응/ 미국 부부/미국 일상 브이로그/외국에서 살기/외국 브이로그,미국엄마와 아기/  한미국제커플, 생일 반응",kUpQ2PStp_k,<class 'datetime.date'>
698,한국 PX 음식 TOP3를 처음 먹어본 외국인들의 반응!?!,2OdbEUGdGmw,<class 'datetime.date'>
699,한국 구독자님께 선물 받은 미국 삼촌의 반응은?!,k3ptKm00-hQ,<class 'datetime.date'>
700,"한국 vs 일본 레전드 애교 모음을 본 외국인 반응 ft  귀여움주의, 니코니코",T2SyjTwvYCY,<class 'datetime.date'>
701,&quot;한국인들의 특이점!&quot; 외국인이 한국에서 별명이 생긴 이유 [해외반응],A5MfXqlVVnw,<class 'datetime.date'>
702,[해외반응] 해외에 올라온 한국 사진 한 장 &quot;오로지 한국에서만 가능한 행동&quot; // 내 인생 새로운 꿈이 생겼다.,3p4AerRwwvw,<class 'datetime.date'>
703,&quot;캬~완전 최고네요!&quot; 한국의 K9 자주포를 시험운용 하면서 함박웃음을 짓게 된 에스토니아 반응,cdqiplUmaXA,<class 'datetime.date'>
704,[Eng] 미국 처부모님들의 첫 한국 아이스크림 반응은? ||My parent in law try Korean Ice cream for the first time||,C1t2turdkZE,<class 'datetime.date'>
705,"&#39;잠적&#39; 고위 외교관, 자진해 한국으로…북한 반응 &#39;주목&#39; / SBS",Lo_x8Qghaoo,<class 'datetime.date'>
706,대만&amp;중국반응│중국 대만침공 할까?│중국 대만 전쟁이 일어난다면?│한국 오기전에 끝내야 vs 상륙전에 전부 수몰│중국어로[路],c8NUZv3JKug,<class 'datetime.date'>
707,[베트남현지반응] &quot;한국의 조상은 베트남인이다&quot; 조회 수 120만 돌파한 충격 영상 // 베트남인이 한국인보다 우월하다,pc4-uKp8p8E,<class 'datetime.date'>
708,"[단독해외반응] 한국 호미가 해외 진출하자 실시간에 벌어진 놀라운 기적, &quot;BTS보다 더 유명한 한국산&quot;",LbRMzfst8m8,<class 'datetime.date'>
709,[중국반응] 백지에서 세계 선두가 된 한국 반도체에서 중국이 해답을 찾는 이유,1yM3GcBk_-E,<class 'datetime.date'>
710,난생 처음 한국 기사식당을 가본 영국 아저씨 반응 (ft. 돼지불백),cn7hlIIr6cQ,<class 'datetime.date'>
711,[해외반응] 한국은 너무 살기좋다며 한국에서 살고싶다고 난리난 해외반응&quot; 너무 감동적이야 나는 한국을 정말 사랑해  &quot;,EVghr_4aQBE,<class 'datetime.date'>
712,일본반응] 일본남자 보다 한국 남자가 좋다는 소식에 질투심 폭발한 일본인들 반응 &quot; 압도적으로 한국남자가 좋다 일본인은 다 싫어해  &quot;,psJceOk9RRk,<class 'datetime.date'>
713,&quot;한국에서만 볼 수 있는 상황!&quot; 외국인이 한국에서 놀란 이유 [해외반응],M9lAYNEelTg,<class 'datetime.date'>
714,외국인이 본 요즘 대한민국 PC방의 현실..😥 PC방에서 할 수 있는 건 다 해봤습니다 (feat. 짜계치) [ENG/SPA SUB] / 별다리 외사친,A6sQw5ltKNA,<class 'datetime.date'>
715,[이창호 기록 깨려다 한국 듣보에게 망해버린 농심배 중국측 반응] 제22회 농심배 1라운드,87JaodOua_c,<class 'datetime.date'>
