,title,video_id,date
1980,"한국에 공룡이?! 미국인 아내 반응은?! (봄휴가 part1 경남고성,상족암)  Dinosaur Footprints in Korea?! - Goseong |국제커플| 🇺🇸🇰🇷 |",-ibecf6IBwI,<class 'datetime.date'>
1981,몽골이 위협에 처하자 한국특수부대가 파견된 이유 수백년만에 한국 몽골 연합 이뤄지나,qyuiYA4Wixc,<class 'datetime.date'>
1982,&quot;일본반응&quot;한국기술 멈추자 일본 정지라는 속보가 나와 당황한 일본 반응 &quot;이제는 인정하자 일본은 한국없이살수가 없는 나라가 되어버렸어&quot;,key4dvJ-74o,<class 'datetime.date'>
1983,&quot;한국의 발전은 이제 무서울 정도&quot; // 한국 가로등 사진 하나에 외국인들이 부러워 미치는 이유 [해외반응],T2TrCJeCwVI,<class 'datetime.date'>
1984,최근 헐리우드 유명 배우가 한국에 있는 모습이 유출되자 전세계가 발칵 뒤집힌 이유,BE1gbcVKCZE,<class 'datetime.date'>
1985,"&quot;미얀마 공동성명에 한국이 아시아 유일하다&quot; 일본이 빠져있다 일본반응에 외국인들,충격 // &quot;선진국들만 참여한 거야&quot; [해외반응]",wOtSoudqdm0,<class 'datetime.date'>
1986,일본반응 | 한국 일반인이 일본 전문가 압도하자 놀란 일본인들 &quot;몇년 연습해야 하는데 한국에선 기본 소양이라고?&quot;,b0muNcPCEgE,<class 'datetime.date'>
1987,중국 비행기 타고 지옥을 경험한 승무원들이 한국 비행기에 타자 깊은 충격을 받은 이유,jlBTFbttydo,<class 'datetime.date'>
1988,[중국반응] 한국 차세대 전투기 KF-21 시제기 출고식,YMAs3auyxRE,<class 'datetime.date'>
1989,[해외반응] &quot;한국은 그냥 미O 나라야!!!&quot; 외국인이 한국에서 이틀 만에 2천만 원 써버리고 감탄하게 된 이유,qIvQCtRZ0o8,<class 'datetime.date'>
1990,미국 인기예능에서 한국 폭탄주 선보이자 관객들이 초토화된 이유?!,M0_fA4-mam8,<class 'datetime.date'>
1991,[해외반응] 급똥의 순간 한국의 위대함을 본 프랑스인,O179cj4A3Po,<class 'datetime.date'>
1992,일본반응 | &#39;이것&#39; 엄청 낮은 한국 보고 놀란 일본반응 &quot;한국인들 국민성이 이렇게 높다니 일본인도 본받아야 하는 수준이다&quot;,VL1s387lpwA,<class 'datetime.date'>
1993,[해외반응] &quot;제발 한국의 반만이라도 따라해줘&quot; 한국 길거리의 흔한 모습에 오열하는 외국인들 &quot;이런 것마저도 한국을 부러워 해야할까&quot;,ayFhuYbK1vg,<class 'datetime.date'>
1994,[해외반응] 한국의 동호회가 세계정상 캐나다를 잡자 충격에 빠진 캐나다의 상황,_7VlM5uORnw,<class 'datetime.date'>
1995,[해외반응] 미국이 한국 양궁 망하게 만들자 분노한 한국 선수들이 장난감 회사 활 가지고 올림픽 금메달 따 버리자 경악한 외국인반응,HOMA1CgVLcE,<class 'datetime.date'>
1996,[해외반응] 최초 한국형 전투기 공개. 외국인들의 반응은?  KF-21 시재기 출고식,Shx_KFCRmL8,<class 'datetime.date'>
1997,"[대만반응] 한국을 욕하고 삼성전자에 도전한 혐한 기업가의 최후 &quot;삼성전자의 통쾌한 한방&quot; / (삼성 해외반응, 대만반응, 해외네티즌반응 등)",-b8IawR5l3U,<class 'datetime.date'>
1998,일본반응|미국CCN이 KF-21로 한국은 엘리트그룹 합류 발표하자 일본인들이 거품물고 분노하는 이유/미국이 한국을 칭찬할리 없어!!!!,8aNsDn6Ef7U,<class 'datetime.date'>
1999,[일본반응] &quot;제발 한국으로 떠날 수 있게 해주세요..&quot; 팬데믹 상황 이후 가장 가고 싶은 도시 1위로 한국의 서울을 꼽은 일본 여성들의 절규,TZvHfRRRgLk,<class 'datetime.date'>
2000,중국 어선이 한국 군함 공격했다가 단 5분만에 일망타진 된 이유,iElfkZZFHms,<class 'datetime.date'>
2001,영화 1987 일본 반응 - 우리가 버블경제일때 한국은 이런 탄압이 있었다니..,NtNmjbZGAaI,<class 'datetime.date'>
2002,[해외반응] &quot;한국은 싫으면 돈을 내라고?&quot; 일본 오염수 방류 결정에 충격받은 외국인 반응,VijD54Lghbo,<class 'datetime.date'>
2003,[일본반응] &quot;왜 일본은 한국보다 가난해졌는가?&quot; 일본은 뒤처지고 있음을 받아들여야 한다는 일본 기자의 팩트 폭력에 당황한 일본인들,DQ7qGfdZNbk,<class 'datetime.date'>
2004,&quot;한국이 왜 선진국이 됐는지 알겠다&quot; 원어민 교사 급식 사진에 감탄하는 외국인반응 // &quot;이러니 한국에 천재가 많은 거야!!!&quot; [해외반응],1zvgQUl1Y6o,<class 'datetime.date'>
2005,중국 해군이 한국 군함인지 모르고 웃으면서 협박했다가 한방에 박살난 이유,iG8bIqXFWds,<class 'datetime.date'>
2006,[일본반응] 일본칼럼 “왜 일본은 한국보다 가난하게 되었는가?” 난리난 일본반응!,Zx0nsOr1SRM,<class 'datetime.date'>
2007,중국반응│한류에 대한 역습을 시작한다│한국 아이돌 입대하는데 중국 병원들 업무가 마비된 이유│한류는 사라졌다며 장담하다 갑자기 한류에 반격한다는 중국반응 │중국어로[路],p32bGkxD4X0,<class 'datetime.date'>
2008,[해외반응]한국여행이 처음인 캐나다인의 부산 여행기/외국인 혼자 떠나는 부산여행 /4박5일동안 풀 관광을 즐기고온 그의 경험담/해운대의 야경은 한국에서 제일 아름답다,lEsmBLTCgZ0,<class 'datetime.date'>
2009,한국 며느리가 낳은 손주를 본 미국 부모님의 첫 반응,PRHZVxz2uug,<class 'datetime.date'>
2010,한국 피자집에 처음 와서 충격먹은 이탈리아인 반응?! 파인애플피자 몰래 먹여봄ㅋㅋ,KjDGGkuC9uw,<class 'datetime.date'>
2011,"남산의 부장들 해외반응, 당시 한국살던 미국인 교수가 봤을땐 역사적 사실..??",U6ZO9C62iZE,<class 'datetime.date'>
2012,떼창의 민족 &quot;떼창 레전드 반응 TOP5&quot; 해외반응 그들이 한국 내한공연을 오는 이유! 그저 감동뿐...,X-yhZ6IjMY0,<class 'datetime.date'>
2013,"딸을 보호하기 위해 한국으로 날아온 부모님, 본국으로 단숨에 귀국하신 이유",rtWf06T5N50,<class 'datetime.date'>
2014,한국에서 일본까지 온 엄청난 선물을 받은 일본 친구들 반응!! 소리지르고 현실부정하고 난리 났습니다 ㅋㅋ,ecD5Jmp_F38,<class 'datetime.date'>
2015,일본반응 | 한국 방문했는데 너무 친절해서 놀랐다는 일본인들 &quot;한국인 차별하는 일본과 정반대로 모두 착해서 미안한 마음이 들었어&quot;,azpF4qOtfwQ,<class 'datetime.date'>
2016,대만반응│대만에 잠수함 건조 도와주러 간 한국 기술진이 철수한 이유│대만이 잠수함 4척만 가지고 있는 이유│한국의 영향력이 크다 하루빨리 조치를│중국어로[路],Hy8vQWyr2h0,<class 'datetime.date'>
2017,"&quot;한국땅과 다름없다!&quot; 러시아 지도의 공개로 인해 화들짝 놀란 일본상황과, 일본총리 방미과정에서 일본의 바람과는 정반대의 입장을 밝힌 미국상황",7wA_S9syQjU,<class 'datetime.date'>
2018,일본반응 | 한국 가전제품 보고 경악한 일본 &quot;한국 기술력은 아무도 못 따라가&quot;,SFuMqzgaAXo,<class 'datetime.date'>
2019,"한국 수제 밀맥주를 마셔본 독일인 반응 (feat. 구독자이벤트) [Korean, ENG Subs]",-UBa6-dkvvY,<class 'datetime.date'>
2020,【일본반응】 한국에 방문한 일본사람들이 한국 사람들이 잡고 있는 것 보고 일본과 왜 다르냐고 한 이유 &quot;한국은 이게 아니야?&quot;,udrI5DpyM_E,<class 'datetime.date'>
2021,"&quot;우리는 일편단심 한국편!&quot; 한국의 무한 지원에 크게 감동한 멕시코와 미얀마 반응과, 일본의 역사왜곡에 맞서 한국과 함께 손잡은 독일과 영국상황",wxiYNLLnt4A,<class 'datetime.date'>
2022,일본반응 | 한국 길가의 광경에 놀란 일본 &quot;한국은 도둑맞을 걱정 안 해?&quot;,7Q-DFSx-RHI,<class 'datetime.date'>
2023,"참전국 터키는 한국의 형제국가인가? 이 몰래 카메라가 조회수 대박난 이유, 터키 이스탄불 여행 하던 한국인 몰카! &#39;Do Turkish Help a Korean?&#39; (ENG)",elfqrq9Z2E4,<class 'datetime.date'>
2024,‘오염수’ 한국 대응 분석하다 현타 제대로 온 일본 방송#일본방송#일본반응#일본어자막,rfRmxn4OdOo,<class 'datetime.date'>
2025,[해외반응] &quot;한국의 특수부대는 허세 그 자체&quot; 일본인 글에 외국인들이 분노한 이유 // &quot;한국 특수부대의 무서움을 알려줄게&quot;,ZIX2O1wOsz0,<class 'datetime.date'>
2026,【일본반응】 자신들은 느린 줄 몰랐다던 일본사람들이 한국 사람들의 초고속 방식에 충격받은 이유 &quot;한국은 이게 필요없다고?&quot;,44Hd7NlsQPA,<class 'datetime.date'>
2027,한국의 아파트에 직접 살아본 외국인들 “겉보기하고는 다르네”(해외반응),-zy1HnkWR9Q,<class 'datetime.date'>
2028,【일본반응】 한국 주방을 보게 된 일본인들이 격세지감을 느끼며 좌절해버린 이유 &quot;한국인들은 모두 음식점에서 살아?&quot;,W-2EZOZEueE,<class 'datetime.date'>
2029,【일본반응】 일본사람이면 아직도 누구나 가지고 있는 전자기기 한국에선 안 쓴지 15년 됐다고 하자 일본인들 충격 받은 이유 &quot;한국 사람들은 그럼 뭘 쓰길래?&quot;,c_DC3vOvrEc,<class 'datetime.date'>
2030,[최신해외반응] 한국의 O밥이 미국 길거리에서 하루만에 1700그릇 팔리자 경악한 외국인반응,ma7fFrOWecs,<class 'datetime.date'>
2031,[일본반응]IMF가 예측한 자료 발표되자 일본인들 분노와 열등감 폭발! 2024년 일본의 경제 상황 한국에 역전된다.,MHeZvmINPZQ,<class 'datetime.date'>
2032,"&quot;도쿄 올림픽을 한국에서 하자고?&quot; 미국 CNN의 설문조사에 일본인들, 정신나간 대답 // &quot;완전히 미쳐버린 일본인들&quot; [해외반응]",8K2bec5uLX0,<class 'datetime.date'>
2033,"&quot;세계1위 한국을 상대할수 없다&quot;는 세계기관들의 한국극찬과 더불어, 일본정부의 오염수 방출이 한국으로 인해 끝내 수포로 돌아갈 것이라는 세계반응에 당혹스러워진 일본상황",S3UdIclOYbs,<class 'datetime.date'>
2034,&quot;내가 사진찍은 곳은 한국이야!&quot; 외국인이 올린 꽃사진을 본 일본반응에 분노한 외국인 반응 // &quot;봄에 한국여행은 최고다&quot; [해외반응],4T6AuIdkxBM,<class 'datetime.date'>
2035,"[일본반응]일본대학생,&quot;졸업후 한국에서일하고싶다&quot; 한국 취업율 상승세로회복했지만 일본은 여전히 최악의경제상황",Keircbkk2eU,<class 'datetime.date'>
2036,[해외반응] 한국에서 아이팟을 잃어버린 후 자국이 부끄러워진 미국인의 사연,vhn2P9aZr1g,<class 'datetime.date'>
2037,해외반응 | &quot;한국은 정말 이상한 나라야&quot; 한국의 안경점을 방문한 외국인들이 충격 받은 이유,i7f5XFjuZD4,<class 'datetime.date'>
2038,일본반응 | 한국의 실질임금 순위가 세계4위라는 발표보다 본인들의 순위가 더욱 충격인 일본반응 | &quot;왜 아시아1등은 항상 한국이야&quot; [해외반응],b9mC8dYNjPY,<class 'datetime.date'>
2039,“아직 안본사람이 부러워!” 영화 곡성 최신해외반응 “한국영화계가 작정하고 호러만들면 이런게 나온다&quot;,lNqwbKYtdfs,<class 'datetime.date'>
2040,[외국인반응] &quot;한국인들은 이래도 불만이라고??&quot; // &quot;오직 한국에서만 느낄 수 있는 10가지 행복&quot; 한 외국인의 리얼 후기에 난리 난 해외반응,C3XfWuPGKd8,<class 'datetime.date'>
2041,"[외국인반응] &quot;한국 때문에 참고 버틴다&quot; 외국인 승무원 충격 발언에 난리 난 이유 // &quot;중국, 일본인과는 비교할 수 없는 민족&quot;",d82pAJjj5-8,<class 'datetime.date'>
2042,[중국반응] 일본 오염수 방류 결정에 5가지 방법으로 맞대응하는 한국을 배우자는 중국 l 일본 잡는덴 역시 한국,huXf6QrhwvU,<class 'datetime.date'>
2043,【해외반응】 일본인들이 당연하다고 여기는 이것 하지만 한국과 점점 벌어지는 격차에 한숨만 쉬는 외국인들 &quot;한국과 일본이 같은 시대가 맞아?&quot;,T76bMrJ8LnY,<class 'datetime.date'>
2044,해외반응 | “한국은 제3세계 국가인가요?” 한국을 비하하는 질문에 해외네티즌들이 내놓은 답변이….,4llzk15IWuM,<class 'datetime.date'>
2045,"일본반응 l 일본은 만들지도 못한 스텔스 전투기를 한국은 해냈다! KF-21 보라매여, 세계를 향해 날아라!!",N1uuXm0SfVU,<class 'datetime.date'>
2046,"[해외반응] 미국 CCGA 충격적인 여론조사 결과 &quot;한국인들이 가장 싫어하는 국가는 일본이 아니다&quot; / (한국 해외반응, 중국반응, 미국반응 등)",0gwKtj0Ixnw,<class 'datetime.date'>
2047,해외반응 | “한국에서는 진정한 친구들을 만나기 매우 쉬워!” 한국인들에 대한 외국인들의 인식이 바뀐 이유는!?,E8BcHmJHO7Q,<class 'datetime.date'>
2048,미국의 전설적인 군 장성이 한국 군대 경험해보고 난 뒤 전세계를 향해 엄중 경고 한 이유,x8s6mjKbm7U,<class 'datetime.date'>
2049,【일본반응】 일본에서는 고급 맨션에서만 볼 수 있는 이것 한국 사람들은 대부분 쓰고 있자 일본 사람들이 이해 못하겠다고 하는 이유 &quot;한국사람들은 왜 이걸 써?&quot;,15wbnbLuV38,<class 'datetime.date'>
2050,[해외반응] &quot;한국이 미국 전투기를 대체할 것&quot; KF-21 분석글에 나온 충격 발언 // &quot;내가 아는 그 한국 맞아??&quot;,_9pYfIR88AA,<class 'datetime.date'>
2051,【일본반응】 일본은 가고 싶어도 못가는데 한국 스타벅스에 사람들 앉아있자 일본 사람들이 이해 못하겠다는 이유 &quot;우리는 자판기에서 먹는데 한국사람들은 아니야?&quot;,hkSt4v1m3_4,<class 'datetime.date'>
2052,"일본반응 l 한국에서는 가능한데 일본에서는 불가능한 이것, 교통비를 아끼기 위해 타는데 돈이 더 드는 이유?",rb2DR8PofD0,<class 'datetime.date'>
2053,&quot;한국이 왜 선진국이 됐는지 알겠다&quot; 한국 OO시간 발표에 난리 난 해외반응 // &quot;이렇게 사는 게 가능하다고??&quot; [외국인반응],PZHQdlRodgw,<class 'datetime.date'>
2054,&quot;일본반응&quot;일본은 선진국 수준의 의식이 없다. 한국따라했다가 쪽팔아버린 일본 반응 &quot;시스템만 아니라 노동법이나 법률도한국을 따라가지 못하는게 아닌가 한다&quot;,6mb1jO2MNeY,<class 'datetime.date'>
2055,【일본반응】 한국의 시내버스를 타본 일본인이 이게 왜 여기 있는 거냐며 충격받은 이유 “한국 대중교통 수준은 혁신적이라더니 솔직히 말해서 이건 상상도 못했다”,36Q7MvG_zJw,<class 'datetime.date'>
2056,"[해외반응 2부] 미국 CNN, 한국의 KF-21은 F-35를 대체할 수 있는 놀라운 전투기라고 보도 / 미국이 한국의 KF-21을 인정한 소식이 보도되자 전세계가 난리난 상황",NprHZ8s18_o,<class 'datetime.date'>
2057,Korean Candy!🍭﻿ 한국 사탕을 먹고 충격 받다?!  외국인 반응😲 (feat. 사탕﻿🍬 ASMR),GjH3KYMFWF8,<class 'datetime.date'>
2058,【해외반응】마른 천으로만 설거지 하던 유럽인이 한국에서 설거지 하는 모습을 보자 비교된다고 하며 좌절한 이유 &quot;이 정도로 차이가 난단 말이야?&quot;,noryaBSkC5M,<class 'datetime.date'>
2059,한국의 당일 배송 서비스에 도전해본 외국인 반응?!,k2zYUOjstFs,<class 'datetime.date'>
2060,"한국 군사 퍼레이드, 한국군 무기 군사력 예비군 위엄, 시가행진에 미얀마 한국인 해외 외국인 파병 반응! South Korea Military Parade, March! [Eng]",rYTfTbOGhFg,<class 'datetime.date'>
2061,[중국반응] 한국의 쿼드 가입과 외교 전략을 분석하는 중국. 결국 한국은 미국편 vs 지금상황은 사실상 중국편 #중국반응 #해외반응 #중국방송,yPNMqSmwmWQ,<class 'datetime.date'>
2062,[해외반응] &quot;왜 한국산으로 표기하는 거야?&quot; 한국 마트를 방문한 일본인 글에 충격받은 외국인들 // &quot;우리는 한국산 딸기를 좋아해&quot;,ncoJctph_n8,<class 'datetime.date'>
2063,일본 vs 한국 공연 패널 반응 비교 #브리튼 갓 탤런트,vFv5HA01uKA,<class 'datetime.date'>
2064,일본반응 | 평범한 한국 병원 모습에 난리난 일본인들 &quot;한국 병원은 이게 다 된다고?&quot;,1V0XKhd5HzE,<class 'datetime.date'>
2065,【일본반응】 일본 거주하는 미국인이 일본사람과 한국사람 비교하자 180도 다른 모습에 충격받은 이유 &quot;일본도 한국처럼 해야한다&quot;,ej-30FlgRUQ,<class 'datetime.date'>
2066,【일본반응】 한국 사람들이 앉아있는 의자 보고 일본 사람들 뭐냐며 당황한 이유 &quot;나는 살면서 처음 보는건데?&quot;,xdoMpcZ7URc,<class 'datetime.date'>
2067,외국인들 한국 미용실 서비스에 감탄하는 반응을 보이는 이유,aN9ouiOK-V8,<class 'datetime.date'>
2068,【일본반응】 일본에서는 최신 제품이지만 한국은 줘도 안 쓴다고 하자 충격 받은 일본인들 &quot;한국 사람들은 대체 뭘 쓰길래?&quot;,xMgGPde60mw,<class 'datetime.date'>
2069,일본반응|&quot;한국이 선진국이라고?&quot; 생선에서 방사능이 검출되자 경악한 일본인들이 빨리 한국으로 도망가야 한다고 울고 있는 이유,NwcRLWY6YJU,<class 'datetime.date'>
2070,[해외반응] &quot;한국을 무시했던 내가 부끄럽다&quot; 한국과 비교되는 일본 노트북 사진에 외국인들이 반성하는 충격적인 이유,sC7rS4JbdXc,<class 'datetime.date'>
2071,【일본반응】 매일 1000원짜리 먹는 일본 사람들이 한국처럼 밥이 먹고 싶다는 이유 &quot;한국 사람들이 정말 부럽다&quot;,6GOpD9MMwdY,<class 'datetime.date'>
2072,"외국인의 서대문형무소 영상에 한국 일본 댓글 전쟁! 유관순 열사, 독립운동 해외 세계 반응! Japanese Occupation of Korea [Eng]",OTiXhMozhHo,<class 'datetime.date'>
2073,일본반응|일본인들이 한국탓이라고 조롱했지만 오히려 인도네시아가 한국편을 들자 극대노 하는 일본인들,iUpSjUhWJV4,<class 'datetime.date'>
2074,현재 미국 갱단이 한국 아저씨를 보면 절대 시비걸지 말라는 이유,zrkL7kLJ6OU,<class 'datetime.date'>
2075,"대만 대학생들 ‘심쿵’ 스킨십, 한국남잔 괜찮아",BZYA2SkvKJ8,<class 'datetime.date'>
2076,한국사는 외국인이 무심코 올린 평범한 길거리 영상에 난리난 해외반응,2lVCuiS1TNw,<class 'datetime.date'>
2077,【일본반응】 일본사람들이 외출 시 꼭하는 이것 한국사람들 때문이라며 난리 난 이유 &quot;한국이 기준을 너무 높여놨어&quot;,DITFifFISfM,<class 'datetime.date'>
2078,"일본반응 l 한국여성들은 당당하지 일본여성들이 순종적인 이유, 일본 여성들이 결혼을 하게 되면 포기할 수 밖에 없는 이것",RfZ2giHTOZk,<class 'datetime.date'>
2079,"일본반응 l 아이들이 자라기 좋은 한국, 노인들이 지내기 좋은 일본. 놀이터와 공원 스케일",9RF_N91-IB0,<class 'datetime.date'>
2080,&quot;일본반응&quot; 일본의 인성 때문에 한국만큼의 자유가 없어질까 불안한 일본반응 &quot;한국처럼 생각이 깨어나게 될까 봐 정부에서 손을 쓰려고 하는 거야&quot;,_wyOfxrXmIQ,<class 'datetime.date'>
2081,일본반응 l 한국은 스케일링 무료! 일본은 유료! 구강구조 열악한 것도 서러운데 일본이 치과가 많은 이유,jrgfF-SlRFc,<class 'datetime.date'>
2082,[TOP5 한국 미신] 한국 미신을 처음 듣는 외국인 아이들의 반응 / Korean Superstitionㅣ 플레이그라운드,JFqwjj11u5Q,<class 'datetime.date'>
2083,【일본반응】 일본에서 한국을 따라한 일본인이 모든 곳에서 거절 당하자 고개를 떨군 이유 &quot;한국과 일본은 너무 다른 세상이다&quot;,_N0kGl3-XZU,<class 'datetime.date'>
2084,일본반응 | 충격적인 사진에 한국 본받자는 일본 &quot;우리 제발 한국을 보고 배우자&quot;,feq6c3-C_Ww,<class 'datetime.date'>
2085,"일본반응 한국의 모든 집에 있는 이것을 보자 일본에는 왜 이것이 없냐는 일본인 / 일본문화,일본소식",FHo39Qr0hcc,<class 'datetime.date'>
2086,중국 어선 300척이 한국 위협하자 이지스함 출격시켜 한방에 보낸 상황,jUKqvpQq3G4,<class 'datetime.date'>
2087,일본반응 | 한국 검사키트에 손가락 빠는 일본 &quot;우리도 좀 나눠주면 안 돼...?&quot;,kNiamhwG1Uc,<class 'datetime.date'>
2088,일본반응 | 거리에서 &#39;이것&#39;하는 한국 모습에 &quot;한국인 국민성은 세계 최고네&quot;,wiCI2EWVXAU,<class 'datetime.date'>
2089,[일본반응] 한국의 고층 아파트 단지를 보자 도쿄는 완전 시골 같다며 난리 난 우익 &quot; 한국의 빌딩 숲은 정말 대단하잖아 완전 선진국 느낌이야&quot;,Amyck3IXQdI,<class 'datetime.date'>
2090,중국반응│대한민국 항공모함 건조 공식 발표│논란 많았지만 항모 반드시 필요│미국과 연합해 중국에 대항하기 위한 것 중국도 준비해야│중국어로[路],HV8_3tkX2m0,<class 'datetime.date'>
2091,[일본반응] 일본칼럼 한국보다 KPOP 팬이 더 많은 나라! 일본! 일본인이 꼭 봐야할 KPOP 영상!,vk7EpqBr4ss,<class 'datetime.date'>
2092,일본반응 |긴급사태! 선언으로 페닉에 빠진 일본인들이 한국이 필요하다고 애원하는 이유/ 도쿄올림픽 개최를 한국과 공동으로 해야한다,_MYF7HJG3uM,<class 'datetime.date'>
2093,"[일본반응] 日 언론 &quot;도쿄올림픽 축구 한국 역대 최고, 일본은 죽음의 조&quot;",q7jMCWZpcHM,<class 'datetime.date'>
2094,"일본반응 한국의 선진화 된 온라인 수업과 일본의 수업이 너무 비교가 되자 현실부정하는 일본문화,일본소식",mdy-7hQvQJg,<class 'datetime.date'>
2095,&quot;독일은 왜 빼먹어요!&quot; 한국의 한류제품을 독일에서도 반드시 출시해달라며 대대적인 움직임을 전개하고 있는 독일네티즌 상황,5MpIOYy8l_I,<class 'datetime.date'>
2096,【일본반응】 편의점 음식이 주식이었던 일본인들이 한국 사람들이 밥 먹는 모습을 보고 부러워 죽겠지만 말을 못하는 이유 &quot;한국에서만 할 수 있는 거잖아...&quot;,f1OMyK856RU,<class 'datetime.date'>
2097,한국여자와 결혼하겠다고 하자 프랑스 부모님이 보인 놀라운 반응,hENRLUystJc,<class 'datetime.date'>
2098,🇰🇷한국배우 &#39;윤여정&#39; &#39;오스카 수상소감&#39; 영화 미나리 관련 해외반응 모음집! l 한글자막 l 인터뷰 모음,st101tGhbm4,<class 'datetime.date'>
2099,해외반응 | 외국인이 보고 놀란 한국 모습!! 왜 한국이 대단한걸 한국인만 모르냐며 난리난 해외반응,BLNm7V7u11M,<class 'datetime.date'>
2100,해외반응 | &quot;역시 한국 사람의 아이디어는 인정해 줘야 해!&quot; 해외 네티즌들이 한국의 ‘이곳’을 보며 열광한 이유는?,6Uf5zP69JQQ,<class 'datetime.date'>
2101,일본반응.2년 후면 한국에 따라잡힌다는 발표가 나오자 뒤늦게 깨달은 일본 넷 우익의분노. 한국은 언제 이렇게 뒤 쫓아 온거야?,rVxY4uUnFdY,<class 'datetime.date'>
2102,【일본반응】 일본에서는 못하는 게 당연하지만 한국은 못하는 사람이 전혀 없어서 일본인들이 이해 못하겠다고 하는 이유 &quot;한국 사람들은 이걸 어떻게 하지?&quot;,tKZvCJSv_rE,<class 'datetime.date'>
2103,&quot;결국 또 한국인이야???&quot; 한국 버스 사진 한 장에 부러워 미치는 외국인반응 // &quot;이러니 한국을 갈 수밖에 없지&quot; [해외반응],Ns5DHiTyBYo,<class 'datetime.date'>
2104,&quot;한국인들은 다 작은 거 아니었어...?&quot; 한국 특수부대에 외국인들이 열광하는 이유 // &quot;한국인들은 분명 아시아인이 아닐 거야&quot; [해외반응],qxBbLhAVQqg,<class 'datetime.date'>
2105,[일본반응] &quot;한국 가정집엔 무조건 있다고?&quot; 일본에서 본 적 없는 물건에 충격 // &quot;한국인들이 이렇게 잘 살았어?&quot;,svuNhPXhk2s,<class 'datetime.date'>
2106,[해외반응] &quot;한국에선 상상도 할 수 없는 일이야&quot; 와이파이 OO 사건에 경악한 외국인 반응,0lM_QlzzE00,<class 'datetime.date'>
2107,[일본반응] 한국에 왔다가 현실 깨닫고 충격 받아 다시 한번 한국 가고 싶다는 일본 반응 &quot; 한국의 거리 분위기는 일본에서는 느낄 수 없으니까&quot;,Kio5SK5a6UQ,<class 'datetime.date'>
2108,"[일본반응] 한국, 현무5 미사일에 필요했던 엔진기술을 성공했다! 세계7위 강대국은 대한민국군!!",89mCU_aRO0o,<class 'datetime.date'>
2109,중국반응│한국 연예인을 너무 좋아하는 해외 스타들│한국 스타에 대한 사랑을 공개적으로 밝힌 중국인 연예인│중국 언론도 중국인들도 모두 포기한 그들의 사랑│중국어로[路],YxJ3ieitz00,<class 'datetime.date'>
